<!ELEMENT APPLICATION ( OVERVIEW?, (PACKAGE | TABLE)*, GENERATOR? ) >
<!ATTLIST APPLICATION NAME CDATA #REQUIRED >

<!ELEMENT ARGUMENT ( COMMENT? ) >
<!ATTLIST ARGUMENT DEFAULT CDATA #IMPLIED >
<!ATTLIST ARGUMENT MODE CDATA #IMPLIED >
<!ATTLIST ARGUMENT NAME CDATA #REQUIRED >
<!ATTLIST ARGUMENT TYPE CDATA #REQUIRED >

<!ELEMENT COMMENT ( #PCDATA ) >

<!ELEMENT COMMENT_FIRST_LINE ( #PCDATA ) >

<!ELEMENT CONSTANT ( COMMENT | COMMENT_FIRST_LINE | RETURN )* >
<!ATTLIST CONSTANT NAME ID #REQUIRED >

<!ELEMENT CURSOR ( ARGUMENT | COMMENT | COMMENT_FIRST_LINE | RETURN )* >
<!ATTLIST CURSOR NAME CDATA #REQUIRED >

<!ELEMENT TAG ( COMMENT? ) >
<!ATTLIST TAG TYPE CDATA #REQUIRED >
<!ATTLIST TAG NAME CDATA #IMPLIED >

<!ELEMENT EXCEPTION ( #PCDATA ) >
<!ATTLIST EXCEPTION NAME CDATA #REQUIRED >

<!ELEMENT FUNCTION ( ARGUMENT | COMMENT | COMMENT_FIRST_LINE | RETURN | TAG )* >
<!ATTLIST FUNCTION NAME CDATA #REQUIRED >

<!ELEMENT OVERVIEW ( #PCDATA ) >

<!ELEMENT PACKAGE ( COMMENT | CONSTANT | CURSOR | EXCEPTION | FUNCTION | PROCEDURE | TYPE | VARIABLE | TAG )* >
<!ATTLIST PACKAGE NAME ID #REQUIRED >
<!ATTLIST PACKAGE SCHEMA CDATA #IMPLIED >

<!ELEMENT PROCEDURE ( ARGUMENT | COMMENT | COMMENT_FIRST_LINE | TAG )* >
<!ATTLIST PROCEDURE NAME CDATA #REQUIRED >

<!ELEMENT RETURN ( COMMENT? ) >
<!ATTLIST RETURN TYPE CDATA #REQUIRED >

<!ELEMENT THROWS ( COMMENT? ) >
<!ATTLIST THROWS NAME CDATA #REQUIRED >

<!ELEMENT FIELD ( COMMENT? ) >
<!ATTLIST FIELD NAME CDATA #REQUIRED >
<!ATTLIST FIELD TYPE CDATA #REQUIRED >

<!ELEMENT TYPE ( COMMENT | COMMENT_FIRST_LINE | FIELD | RETURN | TAG )* >
<!ATTLIST TYPE NAME CDATA #REQUIRED >

<!ELEMENT VARIABLE ( COMMENT | COMMENT_FIRST_LINE | RETURN )* >
<!ATTLIST VARIABLE NAME ID #REQUIRED >

<!ELEMENT TABLE ( COMMENT | COLUMN | TAG )* >
<!ATTLIST TABLE NAME ID #REQUIRED >
<!ATTLIST TABLE SCHEMA CDATA #IMPLIED >

<!ELEMENT COLUMN ( COMMENT? ) >
<!ATTLIST COLUMN CONSTRAINT CDATA #IMPLIED >
<!ATTLIST COLUMN NAME CDATA #REQUIRED >
<!ATTLIST COLUMN TYPE CDATA #REQUIRED >

<!ELEMENT GENERATOR ( OBJECTS, CREATED ) >

<!ELEMENT OBJECTS ( PROCESSED, SKIPPED ) >

<!ELEMENT PROCESSED EMPTY >
<!ATTLIST PROCESSED COUNT CDATA #REQUIRED >

<!ELEMENT SKIPPED ( OBJECT* ) >
<!ATTLIST SKIPPED COUNT CDATA #REQUIRED >

<!ELEMENT OBJECT EMPTY >
<!ATTLIST OBJECT NAME CDATA #REQUIRED >
<!ATTLIST OBJECT ERROR CDATA #REQUIRED >

<!ELEMENT CREATED EMPTY >
<!ATTLIST CREATED DATE CDATA #REQUIRED >
<!ATTLIST CREATED TIME CDATA #REQUIRED >

<!ELEMENT TRIGGER ( COMMENT | COMMENT_FIRST_LINE | DECLARATION | TAG )* >
<!ATTLIST TRIGGER NAME CDATA #REQUIRED >

<!ELEMENT DECLARATION EMPTY >
<!ATTLIST DECLARATION TEXT CDATA #REQUIRED >

